{
  "spec_version": "2.0",
  "job_id": "fixture-props-imported-tool",
  "category": "props",
  "requested_grade": "L1",
  "units": "mm",
  "coordinate_system": {"up": "Z", "handedness": "right"},
  "reference_calibrated": true,
  "measurements": [
    {"id": "tool-global-length", "kind": "global_envelope", "asset_id": "handled-tool", "axis": "Z", "target": 1000.0, "tolerance_abs": 1.0, "required": true, "scope": "global"},
    {"id": "tool-primary-width", "kind": "dimension", "asset_id": "handled-tool", "axis": "X", "target": 200.0, "tolerance_abs": 1.0, "required": true, "scope": "primary"},
    {"id": "tool-base-contact", "kind": "contact", "asset_id": "handled-tool", "target": 0.0, "tolerance_abs": 1.0, "required": true, "scope": "contact"},
    {"id": "tool-butt-tip-anchor-distance", "kind": "distance", "asset_id": "handled-tool", "target": 1000.0, "tolerance_abs": 1.0, "required": true, "scope": "anchor"}
  ]
}
